{"timestamp": "2025-09-16T14:29:01.404403Z", "cycle": 1, "elapsed": 0.001, "interval": 4, "sleep_sec": 3.9986414909362793, "success_rate_pct": null, "options_last_cycle": 0, "options_per_minute": 0.0, "api_success_rate": 0.0, "memory_mb": 97.7109375, "cpu_pct": 0.0, "readiness_ok": false, "readiness_reason": "Non-positive LTP=0", "indices": ["NIFTY", "BANKNIFTY", "FINNIFTY", "SENSEX"], "indices_info": {"NIFTY": {"ltp": 0, "options": 0}, "BANKNIFTY": {"ltp": 0, "options": 0}, "FINNIFTY": {"ltp": 0, "options": 0}, "SENSEX": {"ltp": 0, "options": 0}}}