{"timestamp": "2025-09-25T17:54:31.275467Z", "cycle": 1, "elapsed": 0.0, "interval": 1, "sleep_sec": 0, "success_rate_pct": null, "options_last_cycle": null, "indices": ["NIFTY", "BANKNIFTY", "FINNIFTY", "SENSEX"], "indices_info": {"NIFTY": {"ltp": null, "options": null}, "BANKNIFTY": {"ltp": null, "options": null}, "FINNIFTY": {"ltp": null, "options": null}, "SENSEX": {"ltp": null, "options": null}}, "readiness_ok": true, "readiness_reason": "LTP=20000"}